{"case_id": "M-15p-champion-040", "issues": [{"id": "date", "name": "날짜", "values": ["11-14", "11-15", "11-16", "11-17", "11-18", "11-19"]}, {"id": "time", "name": "시간", "values": ["12:00", "15:00", "18:00", "20:30"]}, {"id": "venue", "name": "장소", "values": ["강남", "홍대", "잠실"]}, {"id": "activity", "name": "활동", "values": ["영화", "식사", "보드게임", "전시"]}], "participants": [{"pid": "P0", "weights": {"date": 0.2333, "time": 0.1849, "venue": 0.3605, "activity": 0.2213}, "scores": {"date": {"11-14": 0.0621, "11-15": 0.8594, "11-16": 0.2928, "11-17": 0.0678, "11-18": 0.0674, "11-19": 0.5266}, "time": {"12:00": 0.4036, "15:00": 0.1767, "18:00": 0.9662, "20:30": 0.298}, "venue": {"강남": 0.1391, "홍대": 0.1248, "잠실": 0.9312}, "activity": {"영화": 0.0173, "식사": 0.8602, "보드게임": 0.4739, "전시": 0.5021}}, "initial_threshold": 0.2871}, {"pid": "P1", "weights": {"date": 0.0657, "time": 0.3909, "venue": 0.4636, "activity": 0.0798}, "scores": {"date": {"11-14": 0.2885, "11-15": 0.9063, "11-16": 0.2516, "11-17": 0.2484, "11-18": 0.1838, "11-19": 0.596}, "time": {"12:00": 0.2326, "15:00": 0.29, "18:00": 0.1551, "20:30": 0.9203}, "venue": {"강남": 0.3589, "홍대": 0.3813, "잠실": 0.9535}, "activity": {"영화": 0.3562, "식사": 0.1995, "보드게임": 0.5966, "전시": 0.878}}, "initial_threshold": 0.3122}, {"pid": "P2", "weights": {"date": 0.2574, "time": 0.5674, "venue": 0.0669, "activity": 0.1083}, "scores": {"date": {"11-14": 0.3065, "11-15": 0.3049, "11-16": 0.8853, "11-17": 0.3419, "11-18": 0.1833, "11-19": 0.3839}, "time": {"12:00": 0.3647, "15:00": 0.1983, "18:00": 0.9645, "20:30": 0.0411}, "venue": {"강남": 0.8895, "홍대": 0.283, "잠실": 0.4585}, "activity": {"영화": 0.4265, "식사": 0.1236, "보드게임": 0.4107, "전시": 0.9614}}, "initial_threshold": 0.295}, {"pid": "P3", "weights": {"date": 0.1165, "time": 0.4121, "venue": 0.2588, "activity": 0.2126}, "scores": {"date": {"11-14": 0.5007, "11-15": 0.4837, "11-16": 0.9663, "11-17": 0.3984, "11-18": 0.1328, "11-19": 0.1555}, "time": {"12:00": 0.5294, "15:00": 0.2852, "18:00": 0.9707, "20:30": 0.2315}, "venue": {"강남": 0.9419, "홍대": 0.3932, "잠실": 0.095}, "activity": {"영화": 0.8792, "식사": 0.0373, "보드게임": 0.4505, "전시": 0.5268}}, "initial_threshold": 0.307}, {"pid": "P4", "weights": {"date": 0.0993, "time": 0.5934, "venue": 0.2309, "activity": 0.0764}, "scores": {"date": {"11-14": 0.9561, "11-15": 0.2079, "11-16": 0.5958, "11-17": 0.3775, "11-18": 0.3192, "11-19": 0.5121}, "time": {"12:00": 0.47, "15:00": 0.8774, "18:00": 0.1177, "20:30": 0.1976}, "venue": {"강남": 0.0213, "홍대": 0.1982, "잠실": 0.9387}, "activity": {"영화": 0.9945, "식사": 0.0825, "보드게임": 0.0399, "전시": 0.3925}}, "initial_threshold": 0.3075}, {"pid": "P5", "weights": {"date": 0.1368, "time": 0.3001, "venue": 0.3126, "activity": 0.2505}, "scores": {"date": {"11-14": 0.5344, "11-15": 0.2405, "11-16": 0.8837, "11-17": 0.1614, "11-18": 0.2995, "11-19": 0.3501}, "time": {"12:00": 0.9305, "15:00": 0.5396, "18:00": 0.3773, "20:30": 0.0051}, "venue": {"강남": 0.2927, "홍대": 0.3015, "잠실": 0.8812}, "activity": {"영화": 0.5331, "식사": 0.1947, "보드게임": 0.2019, "전시": 0.8754}}, "initial_threshold": 0.3369}, {"pid": "P6", "weights": {"date": 0.1836, "time": 0.1147, "venue": 0.6259, "activity": 0.0758}, "scores": {"date": {"11-14": 0.0148, "11-15": 0.3833, "11-16": 0.1176, "11-17": 0.3771, "11-18": 0.9149, "11-19": 0.3952}, "time": {"12:00": 0.333, "15:00": 0.569, "18:00": 0.393, "20:30": 0.9816}, "venue": {"강남": 0.5816, "홍대": 0.2481, "잠실": 0.9156}, "activity": {"영화": 0.8714, "식사": 0.4524, "보드게임": 0.4029, "전시": 0.2012}}, "initial_threshold": 0.3299}, {"pid": "P7", "weights": {"date": 0.155, "time": 0.2652, "venue": 0.3175, "activity": 0.2623}, "scores": {"date": {"11-14": 0.4201, "11-15": 0.4675, "11-16": 0.1265, "11-17": 0.1319, "11-18": 0.9371, "11-19": 0.0963}, "time": {"12:00": 0.4791, "15:00": 0.2953, "18:00": 0.9728, "20:30": 0.1872}, "venue": {"강남": 0.4412, "홍대": 0.9466, "잠실": 0.0516}, "activity": {"영화": 0.3316, "식사": 0.3199, "보드게임": 0.0597, "전시": 0.9332}}, "initial_threshold": 0.2998}, {"pid": "P8", "weights": {"date": 0.2645, "time": 0.1081, "venue": 0.3614, "activity": 0.266}, "scores": {"date": {"11-14": 0.1576, "11-15": 0.4428, "11-16": 0.3551, "11-17": 0.4127, "11-18": 0.339, "11-19": 0.9325}, "time": {"12:00": 0.9741, "15:00": 0.3122, "18:00": 0.4666, "20:30": 0.4703}, "venue": {"강남": 0.53, "홍대": 0.9359, "잠실": 0.0917}, "activity": {"영화": 0.4738, "식사": 0.3123, "보드게임": 0.9459, "전시": 0.1868}}, "initial_threshold": 0.3267}, {"pid": "P9", "weights": {"date": 0.2854, "time": 0.262, "venue": 0.2658, "activity": 0.1868}, "scores": {"date": {"11-14": 0.1425, "11-15": 0.9823, "11-16": 0.2243, "11-17": 0.3257, "11-18": 0.1627, "11-19": 0.0802}, "time": {"12:00": 0.0361, "15:00": 0.9345, "18:00": 0.4316, "20:30": 0.3062}, "venue": {"강남": 0.2664, "홍대": 0.9713, "잠실": 0.1182}, "activity": {"영화": 0.2038, "식사": 0.3142, "보드게임": 0.5511, "전시": 0.8708}}, "initial_threshold": 0.2939}, {"pid": "P10", "weights": {"date": 0.08, "time": 0.2757, "venue": 0.1669, "activity": 0.4774}, "scores": {"date": {"11-14": 0.4047, "11-15": 0.1487, "11-16": 0.1584, "11-17": 0.5648, "11-18": 0.3503, "11-19": 0.8577}, "time": {"12:00": 0.3582, "15:00": 0.5282, "18:00": 0.5347, "20:30": 0.8707}, "venue": {"강남": 0.9088, "홍대": 0.0502, "잠실": 0.5456}, "activity": {"영화": 0.94, "식사": 0.2418, "보드게임": 0.0644, "전시": 0.0497}}, "initial_threshold": 0.2868}, {"pid": "P11", "weights": {"date": 0.1171, "time": 0.2099, "venue": 0.3292, "activity": 0.3438}, "scores": {"date": {"11-14": 0.1242, "11-15": 0.8997, "11-16": 0.4031, "11-17": 0.4977, "11-18": 0.0327, "11-19": 0.4913}, "time": {"12:00": 0.1304, "15:00": 0.3777, "18:00": 0.9745, "20:30": 0.2402}, "venue": {"강남": 0.9641, "홍대": 0.0802, "잠실": 0.453}, "activity": {"영화": 0.877, "식사": 0.1328, "보드게임": 0.2348, "전시": 0.1733}}, "initial_threshold": 0.3275}, {"pid": "P12", "weights": {"date": 0.1138, "time": 0.1997, "venue": 0.3415, "activity": 0.345}, "scores": {"date": {"11-14": 0.4839, "11-15": 0.2527, "11-16": 0.3156, "11-17": 0.9972, "11-18": 0.5484, "11-19": 0.1935}, "time": {"12:00": 0.581, "15:00": 0.2576, "18:00": 0.9917, "20:30": 0.0343}, "venue": {"강남": 0.9934, "홍대": 0.338, "잠실": 0.1842}, "activity": {"영화": 0.1452, "식사": 0.4535, "보드게임": 0.9169, "전시": 0.2477}}, "initial_threshold": 0.3103}, {"pid": "P13", "weights": {"date": 0.252, "time": 0.0751, "venue": 0.2784, "activity": 0.3945}, "scores": {"date": {"11-14": 0.1746, "11-15": 0.9146, "11-16": 0.4963, "11-17": 0.5504, "11-18": 0.5183, "11-19": 0.4032}, "time": {"12:00": 0.96, "15:00": 0.1984, "18:00": 0.3674, "20:30": 0.2164}, "venue": {"강남": 0.9936, "홍대": 0.0177, "잠실": 0.4075}, "activity": {"영화": 0.9762, "식사": 0.4261, "보드게임": 0.1493, "전시": 0.5284}}, "initial_threshold": 0.3305}, {"pid": "P14", "weights": {"date": 0.2671, "time": 0.3121, "venue": 0.316, "activity": 0.1048}, "scores": {"date": {"11-14": 0.3258, "11-15": 0.3205, "11-16": 0.2976, "11-17": 0.1347, "11-18": 0.3311, "11-19": 0.8838}, "time": {"12:00": 0.4494, "15:00": 0.9673, "18:00": 0.0882, "20:30": 0.4879}, "venue": {"강남": 0.2746, "홍대": 0.1377, "잠실": 0.9733}, "activity": {"영화": 0.4315, "식사": 0.9476, "보드게임": 0.4419, "전시": 0.0634}}, "initial_threshold": 0.3132}], "meta": {"schema_version": "issue-space-case.v1", "track": "issue_space", "scenario_type": "champion", "combination_count": 288, "issue_sizes": [6, 4, 3, 4], "common_feasible_count": 11, "expected_no_deal": false, "tags": ["track:main", "participants:15", "type:champion", "k:11", "feasible_ratio:0.0382"], "description": "main 트랙 — 15인·champion 유형. 의제 4개(6×4×3×4=288 조합), utility는 의제 가중합. 공통 유효 후보 11개 (threshold 캘리브레이션, 생성기 참조)."}}