{
  "case_id": "I-03p-S001575-006",
  "issues": [
    {
      "id": "date",
      "name": "날짜",
      "values": [
        "11-15",
        "11-16",
        "11-17",
        "11-18",
        "11-19",
        "11-20",
        "11-21",
        "11-22",
        "11-23"
      ]
    },
    {
      "id": "time",
      "name": "시간",
      "values": [
        "12:00",
        "12:30",
        "13:00",
        "13:30",
        "14:00",
        "14:30",
        "15:00"
      ]
    },
    {
      "id": "venue",
      "name": "영화관",
      "values": [
        "강남",
        "홍대",
        "잠실",
        "왕십리",
        "용산"
      ]
    },
    {
      "id": "movie",
      "name": "영화",
      "values": [
        "겨울 항해",
        "붉은 사막",
        "야간비행",
        "종이 도시",
        "여덟 번째 계절"
      ]
    }
  ],
  "participants": [
    {
      "pid": "P0",
      "initial_threshold": 0.465,
      "weights": {
        "date": 0.3396,
        "time": 0.2253,
        "venue": 0.2027,
        "movie": 0.2324
      },
      "scores": {
        "date": {
          "11-15": 0.5975,
          "11-16": 0.2136,
          "11-17": 0.7817,
          "11-18": 0.7498,
          "11-19": 0.0645,
          "11-20": 0.9213,
          "11-21": 0.4056,
          "11-22": 0.8014,
          "11-23": 0.2125
        },
        "time": {
          "12:00": 0.229,
          "12:30": 0.996,
          "13:00": 0.7428,
          "13:30": 0.0886,
          "14:00": 0.0097,
          "14:30": 0.7745,
          "15:00": 0.2013
        },
        "venue": {
          "강남": 0.0536,
          "홍대": 0.4555,
          "잠실": 0.0026,
          "왕십리": 0.5629,
          "용산": 0.3396
        },
        "movie": {
          "겨울 항해": 0.4751,
          "붉은 사막": 0.4511,
          "야간비행": 0.2244,
          "종이 도시": 0.912,
          "여덟 번째 계절": 0.746
        }
      }
    },
    {
      "pid": "P1",
      "initial_threshold": 0.451,
      "weights": {
        "date": 0.2763,
        "time": 0.3642,
        "venue": 0.1101,
        "movie": 0.2494
      },
      "scores": {
        "date": {
          "11-15": 0.2976,
          "11-16": 0.7741,
          "11-17": 0.2975,
          "11-18": 0.3373,
          "11-19": 0.5935,
          "11-20": 0.8163,
          "11-21": 0.3339,
          "11-22": 0.1311,
          "11-23": 0.1318
        },
        "time": {
          "12:00": 0.6601,
          "12:30": 0.6442,
          "13:00": 0.6557,
          "13:30": 0.2978,
          "14:00": 0.5156,
          "14:30": 0.897,
          "15:00": 0.9085
        },
        "venue": {
          "강남": 0.1757,
          "홍대": 0.5123,
          "잠실": 0.8625,
          "왕십리": 0.4056,
          "용산": 0.3577
        },
        "movie": {
          "겨울 항해": 0.469,
          "붉은 사막": 0.6443,
          "야간비행": 0.9585,
          "종이 도시": 0.433,
          "여덟 번째 계절": 0.1777
        }
      }
    },
    {
      "pid": "P2",
      "initial_threshold": 0.562,
      "weights": {
        "date": 0.2237,
        "time": 0.3634,
        "venue": 0.2851,
        "movie": 0.1278
      },
      "scores": {
        "date": {
          "11-15": 0.572,
          "11-16": 0.5275,
          "11-17": 0.992,
          "11-18": 0.1168,
          "11-19": 0.9946,
          "11-20": 0.5816,
          "11-21": 0.1487,
          "11-22": 0.0235,
          "11-23": 0.3746
        },
        "time": {
          "12:00": 0.4997,
          "12:30": 0.4109,
          "13:00": 0.3741,
          "13:30": 0.8858,
          "14:00": 0.3701,
          "14:30": 0.8828,
          "15:00": 0.4551
        },
        "venue": {
          "강남": 0.6295,
          "홍대": 0.941,
          "잠실": 0.2644,
          "왕십리": 0.1877,
          "용산": 0.8961
        },
        "movie": {
          "겨울 항해": 0.992,
          "붉은 사막": 0.2136,
          "야간비행": 0.8654,
          "종이 도시": 0.6883,
          "여덟 번째 계절": 0.4964
        }
      }
    }
  ],
  "meta": {
    "schema_version": "issue-space-case.v1",
    "track": "issue_space",
    "scenario_type": "movie_appointment",
    "combination_count": 1575,
    "issue_sizes": [
      9,
      7,
      5,
      5
    ],
    "common_feasible_count": 280,
    "expected_no_deal": false,
    "description": "영화 약속 3인 사례 — 의제 4개(날짜 9 × 시간 7 × 영화관 5 × 영화 5) = 조합 1,575개. 후보는 의제 값의 곱이며 utility는 의제 가중합으로 실행 시 계산한다. 전원의 initial threshold를 넘는 공통 실후보는 280개다."
  }
}
