{
  "case_id": "I-05p-S000576-002",
  "issues": [
    {
      "id": "date",
      "name": "날짜",
      "values": [
        "11-15",
        "11-16",
        "11-17",
        "11-18"
      ]
    },
    {
      "id": "time",
      "name": "시간",
      "values": [
        "12:00",
        "12:30",
        "13:00",
        "13:30"
      ]
    },
    {
      "id": "venue",
      "name": "영화관",
      "values": [
        "강남",
        "홍대",
        "잠실",
        "왕십리"
      ]
    },
    {
      "id": "movie",
      "name": "영화",
      "values": [
        "겨울 항해",
        "붉은 사막",
        "야간비행"
      ]
    },
    {
      "id": "seat",
      "name": "좌석",
      "values": [
        "일반",
        "프리미엄",
        "리클라이너"
      ]
    }
  ],
  "participants": [
    {
      "pid": "P0",
      "initial_threshold": 0.623,
      "weights": {
        "date": 0.1893,
        "time": 0.1498,
        "venue": 0.3381,
        "movie": 0.2061,
        "seat": 0.1167
      },
      "scores": {
        "date": {
          "11-15": 0.0666,
          "11-16": 0.9693,
          "11-17": 0.0662,
          "11-18": 0.4976
        },
        "time": {
          "12:00": 0.4466,
          "12:30": 0.1961,
          "13:00": 0.5197,
          "13:30": 0.5147
        },
        "venue": {
          "강남": 0.3717,
          "홍대": 0.3706,
          "잠실": 0.9982,
          "왕십리": 0.9739
        },
        "movie": {
          "겨울 항해": 0.4378,
          "붉은 사막": 0.5045,
          "야간비행": 0.1342
        },
        "seat": {
          "일반": 0.3721,
          "프리미엄": 0.4489,
          "리클라이너": 0.2727
        }
      }
    },
    {
      "pid": "P1",
      "initial_threshold": 0.6114,
      "weights": {
        "date": 0.2046,
        "time": 0.2542,
        "venue": 0.1612,
        "movie": 0.1777,
        "seat": 0.2023
      },
      "scores": {
        "date": {
          "11-15": 0.6168,
          "11-16": 0.6911,
          "11-17": 0.8933,
          "11-18": 0.0233
        },
        "time": {
          "12:00": 0.2267,
          "12:30": 0.4641,
          "13:00": 0.5687,
          "13:30": 0.654
        },
        "venue": {
          "강남": 0.0069,
          "홍대": 0.9054,
          "잠실": 0.0182,
          "왕십리": 0.889
        },
        "movie": {
          "겨울 항해": 0.8183,
          "붉은 사막": 0.6078,
          "야간비행": 0.917
        },
        "seat": {
          "일반": 0.2666,
          "프리미엄": 0.7555,
          "리클라이너": 0.8867
        }
      }
    },
    {
      "pid": "P2",
      "initial_threshold": 0.6225,
      "weights": {
        "date": 0.2736,
        "time": 0.1574,
        "venue": 0.2313,
        "movie": 0.1488,
        "seat": 0.1889
      },
      "scores": {
        "date": {
          "11-15": 0.3362,
          "11-16": 0.6171,
          "11-17": 0.4775,
          "11-18": 0.8555
        },
        "time": {
          "12:00": 0.4019,
          "12:30": 0.2397,
          "13:00": 0.7799,
          "13:30": 0.3351
        },
        "venue": {
          "강남": 0.5143,
          "홍대": 0.7905,
          "잠실": 0.5071,
          "왕십리": 0.9011
        },
        "movie": {
          "겨울 항해": 0.2212,
          "붉은 사막": 0.6825,
          "야간비행": 0.0416
        },
        "seat": {
          "일반": 0.9026,
          "프리미엄": 0.7181,
          "리클라이너": 0.1553
        }
      }
    },
    {
      "pid": "P3",
      "initial_threshold": 0.6193,
      "weights": {
        "date": 0.233,
        "time": 0.1074,
        "venue": 0.2511,
        "movie": 0.218,
        "seat": 0.1905
      },
      "scores": {
        "date": {
          "11-15": 0.3969,
          "11-16": 0.7123,
          "11-17": 0.0499,
          "11-18": 0.6522
        },
        "time": {
          "12:00": 0.521,
          "12:30": 0.0947,
          "13:00": 0.8579,
          "13:30": 0.6596
        },
        "venue": {
          "강남": 0.1276,
          "홍대": 0.21,
          "잠실": 0.4098,
          "왕십리": 0.8903
        },
        "movie": {
          "겨울 항해": 0.1817,
          "붉은 사막": 0.8726,
          "야간비행": 0.3387
        },
        "seat": {
          "일반": 0.0359,
          "프리미엄": 0.4835,
          "리클라이너": 0.7103
        }
      }
    },
    {
      "pid": "P4",
      "initial_threshold": 0.5921,
      "weights": {
        "date": 0.2966,
        "time": 0.0961,
        "venue": 0.2362,
        "movie": 0.1374,
        "seat": 0.2337
      },
      "scores": {
        "date": {
          "11-15": 0.1063,
          "11-16": 0.9598,
          "11-17": 0.4961,
          "11-18": 0.5325
        },
        "time": {
          "12:00": 0.7024,
          "12:30": 0.4539,
          "13:00": 0.0022,
          "13:30": 0.5115
        },
        "venue": {
          "강남": 0.5934,
          "홍대": 0.7225,
          "잠실": 0.6817,
          "왕십리": 0.8611
        },
        "movie": {
          "겨울 항해": 0.5346,
          "붉은 사막": 0.2877,
          "야간비행": 0.1225
        },
        "seat": {
          "일반": 0.2127,
          "프리미엄": 0.0894,
          "리클라이너": 0.2078
        }
      }
    }
  ],
  "meta": {
    "schema_version": "issue-space-case.v1",
    "track": "issue_space",
    "scenario_type": "movie_appointment",
    "combination_count": 576,
    "issue_sizes": [
      4,
      4,
      4,
      3,
      3
    ],
    "common_feasible_count": 3,
    "expected_no_deal": false,
    "tags": [
      "track:a",
      "issues:5",
      "participants:5",
      "feasible_ratio:0.0052"
    ],
    "description": "영화 약속 5인 사례 — 의제 5개(날짜 4 × 시간 4 × 영화관 4 × 영화 3 × 좌석 3) = 조합 576개. 후보는 의제 값의 곱이며 utility는 의제 가중합으로 실행 시 계산한다. 전원의 initial threshold를 넘는 공통 실후보는 3개다."
  }
}
