{
  "case_id": "I-05p-S062208-008",
  "issues": [
    {
      "id": "date",
      "name": "날짜",
      "values": [
        "11-15",
        "11-16",
        "11-17",
        "11-18"
      ]
    },
    {
      "id": "time",
      "name": "시간",
      "values": [
        "12:00",
        "12:30",
        "13:00",
        "13:30"
      ]
    },
    {
      "id": "venue",
      "name": "영화관",
      "values": [
        "강남",
        "홍대",
        "잠실",
        "왕십리"
      ]
    },
    {
      "id": "movie",
      "name": "영화",
      "values": [
        "겨울 항해",
        "붉은 사막",
        "야간비행"
      ]
    },
    {
      "id": "seat",
      "name": "좌석",
      "values": [
        "일반",
        "프리미엄",
        "리클라이너"
      ]
    },
    {
      "id": "format",
      "name": "상영 형식",
      "values": [
        "2D",
        "3D",
        "IMAX"
      ]
    },
    {
      "id": "meal",
      "name": "식사",
      "values": [
        "관람 전 식사",
        "관람 후 식사",
        "간식만"
      ]
    },
    {
      "id": "transport",
      "name": "이동",
      "values": [
        "지하철",
        "버스",
        "자차"
      ]
    },
    {
      "id": "budget",
      "name": "예산",
      "values": [
        "1만원대",
        "1만5천원대"
      ]
    },
    {
      "id": "after",
      "name": "관람 후",
      "values": [
        "바로 귀가",
        "카페"
      ]
    }
  ],
  "participants": [
    {
      "pid": "P0",
      "initial_threshold": 0.4952,
      "weights": {
        "date": 0.0804,
        "time": 0.0857,
        "venue": 0.0993,
        "movie": 0.1299,
        "seat": 0.1243,
        "format": 0.098,
        "meal": 0.0845,
        "transport": 0.1057,
        "budget": 0.105,
        "after": 0.0872
      },
      "scores": {
        "date": {
          "11-15": 0.2211,
          "11-16": 0.081,
          "11-17": 0.0023,
          "11-18": 0.6602
        },
        "time": {
          "12:00": 0.6378,
          "12:30": 0.278,
          "13:00": 0.3066,
          "13:30": 0.8363
        },
        "venue": {
          "강남": 0.3564,
          "홍대": 0.8837,
          "잠실": 0.3621,
          "왕십리": 0.0586
        },
        "movie": {
          "겨울 항해": 0.9057,
          "붉은 사막": 0.6492,
          "야간비행": 0.3517
        },
        "seat": {
          "일반": 0.3054,
          "프리미엄": 0.9335,
          "리클라이너": 0.1887
        },
        "format": {
          "2D": 0.6683,
          "3D": 0.0517,
          "IMAX": 0.9631
        },
        "meal": {
          "관람 전 식사": 0.1027,
          "관람 후 식사": 0.6024,
          "간식만": 0.674
        },
        "transport": {
          "지하철": 0.0404,
          "버스": 0.2852,
          "자차": 0.5565
        },
        "budget": {
          "1만원대": 0.4678,
          "1만5천원대": 0.8446
        },
        "after": {
          "바로 귀가": 0.4453,
          "카페": 0.1868
        }
      }
    },
    {
      "pid": "P1",
      "initial_threshold": 0.4412,
      "weights": {
        "date": 0.0983,
        "time": 0.0964,
        "venue": 0.0873,
        "movie": 0.0914,
        "seat": 0.0886,
        "format": 0.0985,
        "meal": 0.1185,
        "transport": 0.1271,
        "budget": 0.1058,
        "after": 0.0881
      },
      "scores": {
        "date": {
          "11-15": 0.8547,
          "11-16": 0.1649,
          "11-17": 0.0658,
          "11-18": 0.4967
        },
        "time": {
          "12:00": 0.1932,
          "12:30": 0.0086,
          "13:00": 0.4046,
          "13:30": 0.1202
        },
        "venue": {
          "강남": 0.1629,
          "홍대": 0.4418,
          "잠실": 0.4312,
          "왕십리": 0.9902
        },
        "movie": {
          "겨울 항해": 0.9268,
          "붉은 사막": 0.794,
          "야간비행": 0.59
        },
        "seat": {
          "일반": 0.5604,
          "프리미엄": 0.1415,
          "리클라이너": 0.9173
        },
        "format": {
          "2D": 0.2326,
          "3D": 0.019,
          "IMAX": 0.3522
        },
        "meal": {
          "관람 전 식사": 0.9585,
          "관람 후 식사": 0.1664,
          "간식만": 0.5731
        },
        "transport": {
          "지하철": 0.1027,
          "버스": 0.8113,
          "자차": 0.6872
        },
        "budget": {
          "1만원대": 0.8173,
          "1만5천원대": 0.3448
        },
        "after": {
          "바로 귀가": 0.8875,
          "카페": 0.2693
        }
      }
    },
    {
      "pid": "P2",
      "initial_threshold": 0.4911,
      "weights": {
        "date": 0.1002,
        "time": 0.1035,
        "venue": 0.0828,
        "movie": 0.1116,
        "seat": 0.1157,
        "format": 0.1018,
        "meal": 0.1152,
        "transport": 0.1053,
        "budget": 0.0829,
        "after": 0.081
      },
      "scores": {
        "date": {
          "11-15": 0.7135,
          "11-16": 0.184,
          "11-17": 0.8095,
          "11-18": 0.2535
        },
        "time": {
          "12:00": 0.1962,
          "12:30": 0.9447,
          "13:00": 0.1717,
          "13:30": 0.0843
        },
        "venue": {
          "강남": 0.0487,
          "홍대": 0.2171,
          "잠실": 0.09,
          "왕십리": 0.1795
        },
        "movie": {
          "겨울 항해": 0.5979,
          "붉은 사막": 0.2936,
          "야간비행": 0.9187
        },
        "seat": {
          "일반": 0.5422,
          "프리미엄": 0.8341,
          "리클라이너": 0.3697
        },
        "format": {
          "2D": 0.9058,
          "3D": 0.8363,
          "IMAX": 0.7252
        },
        "meal": {
          "관람 전 식사": 0.3419,
          "관람 후 식사": 0.2478,
          "간식만": 0.2373
        },
        "transport": {
          "지하철": 0.3324,
          "버스": 0.7901,
          "자차": 0.2642
        },
        "budget": {
          "1만원대": 0.4321,
          "1만5천원대": 0.1832
        },
        "after": {
          "바로 귀가": 0.8114,
          "카페": 0.102
        }
      }
    },
    {
      "pid": "P3",
      "initial_threshold": 0.4622,
      "weights": {
        "date": 0.0877,
        "time": 0.0923,
        "venue": 0.1185,
        "movie": 0.0974,
        "seat": 0.1005,
        "format": 0.1481,
        "meal": 0.0835,
        "transport": 0.0849,
        "budget": 0.106,
        "after": 0.0811
      },
      "scores": {
        "date": {
          "11-15": 0.2487,
          "11-16": 0.2516,
          "11-17": 0.246,
          "11-18": 0.4167
        },
        "time": {
          "12:00": 0.3196,
          "12:30": 0.6447,
          "13:00": 0.4589,
          "13:30": 0.563
        },
        "venue": {
          "강남": 0.4133,
          "홍대": 0.1195,
          "잠실": 0.2211,
          "왕십리": 0.0956
        },
        "movie": {
          "겨울 항해": 0.5656,
          "붉은 사막": 0.9589,
          "야간비행": 0.8741
        },
        "seat": {
          "일반": 0.9746,
          "프리미엄": 0.9111,
          "리클라이너": 0.3614
        },
        "format": {
          "2D": 0.6324,
          "3D": 0.6276,
          "IMAX": 0.6318
        },
        "meal": {
          "관람 전 식사": 0.3364,
          "관람 후 식사": 0.5943,
          "간식만": 0.5608
        },
        "transport": {
          "지하철": 0.895,
          "버스": 0.1241,
          "자차": 0.1326
        },
        "budget": {
          "1만원대": 0.1673,
          "1만5천원대": 0.1252
        },
        "after": {
          "바로 귀가": 0.2235,
          "카페": 0.8644
        }
      }
    },
    {
      "pid": "P4",
      "initial_threshold": 0.479,
      "weights": {
        "date": 0.108,
        "time": 0.1054,
        "venue": 0.1016,
        "movie": 0.0917,
        "seat": 0.1201,
        "format": 0.0825,
        "meal": 0.1134,
        "transport": 0.0957,
        "budget": 0.0867,
        "after": 0.0949
      },
      "scores": {
        "date": {
          "11-15": 0.0963,
          "11-16": 0.4156,
          "11-17": 0.7443,
          "11-18": 0.1981
        },
        "time": {
          "12:00": 0.283,
          "12:30": 0.4481,
          "13:00": 0.0807,
          "13:30": 0.4827
        },
        "venue": {
          "강남": 0.0156,
          "홍대": 0.2255,
          "잠실": 0.1332,
          "왕십리": 0.4026
        },
        "movie": {
          "겨울 항해": 0.6728,
          "붉은 사막": 0.5472,
          "야간비행": 0.2987
        },
        "seat": {
          "일반": 0.8142,
          "프리미엄": 0.6436,
          "리클라이너": 0.5565
        },
        "format": {
          "2D": 0.3525,
          "3D": 0.713,
          "IMAX": 0.3401
        },
        "meal": {
          "관람 전 식사": 0.9008,
          "관람 후 식사": 0.2674,
          "간식만": 0.0832
        },
        "transport": {
          "지하철": 0.8337,
          "버스": 0.947,
          "자차": 0.5602
        },
        "budget": {
          "1만원대": 0.6657,
          "1만5천원대": 0.8994
        },
        "after": {
          "바로 귀가": 0.0887,
          "카페": 0.188
        }
      }
    }
  ],
  "meta": {
    "schema_version": "issue-space-case.v1",
    "track": "issue_space",
    "scenario_type": "movie_appointment",
    "combination_count": 62208,
    "issue_sizes": [
      4,
      4,
      4,
      3,
      3,
      3,
      3,
      3,
      2,
      2
    ],
    "common_feasible_count": 342,
    "expected_no_deal": false,
    "tags": [
      "track:a",
      "issues:10",
      "participants:5",
      "feasible_ratio:0.0055"
    ],
    "description": "영화 약속 5인 사례 — 의제 10개(날짜 4 × 시간 4 × 영화관 4 × 영화 3 × 좌석 3 × 상영 형식 3 × 식사 3 × 이동 3 × 예산 2 × 관람 후 2) = 조합 62,208개. 후보는 의제 값의 곱이며 utility는 의제 가중합으로 실행 시 계산한다. 전원의 initial threshold를 넘는 공통 실후보는 342개다."
  }
}
