{
  "case_id": "I-03p-S100000-008",
  "issues": [
    {
      "id": "date",
      "name": "날짜",
      "values": [
        "11-15",
        "11-16",
        "11-17",
        "11-18",
        "11-19",
        "11-20",
        "11-21",
        "11-22",
        "11-23",
        "11-24",
        "11-25",
        "11-26",
        "11-27",
        "11-28",
        "11-29",
        "11-30",
        "12-01",
        "12-02",
        "12-03",
        "12-04",
        "12-05",
        "12-06",
        "12-07",
        "12-08",
        "12-09"
      ]
    },
    {
      "id": "time",
      "name": "시간",
      "values": [
        "12:00",
        "12:30",
        "13:00",
        "13:30",
        "14:00",
        "14:30",
        "15:00",
        "15:30",
        "16:00",
        "16:30",
        "17:00",
        "17:30",
        "18:00",
        "18:30",
        "19:00",
        "19:30",
        "20:00",
        "20:30",
        "21:00",
        "21:30"
      ]
    },
    {
      "id": "venue",
      "name": "영화관",
      "values": [
        "강남",
        "홍대",
        "잠실",
        "왕십리",
        "용산",
        "영등포",
        "신촌",
        "건대입구",
        "목동",
        "코엑스"
      ]
    },
    {
      "id": "movie",
      "name": "영화",
      "values": [
        "겨울 항해",
        "붉은 사막",
        "야간비행",
        "종이 도시",
        "여덟 번째 계절",
        "파란 문",
        "먼 북소리",
        "은하 정거장",
        "조용한 이웃",
        "마지막 정류장",
        "빛의 속도로",
        "검은 숲",
        "유리 정원",
        "새벽 세 시",
        "천 개의 파도",
        "우연한 여행자",
        "달의 뒷면",
        "낮은 목소리",
        "회색 항구",
        "봄의 알고리즘"
      ]
    }
  ],
  "participants": [
    {
      "pid": "P0",
      "initial_threshold": 0.362,
      "weights": {
        "date": 0.3228,
        "time": 0.226,
        "venue": 0.138,
        "movie": 0.3132
      },
      "scores": {
        "date": {
          "11-15": 0.8465,
          "11-16": 0.1865,
          "11-17": 0.367,
          "11-18": 0.1687,
          "11-19": 0.6456,
          "11-20": 0.8167,
          "11-21": 0.6686,
          "11-22": 0.1288,
          "11-23": 0.8811,
          "11-24": 0.2037,
          "11-25": 0.7968,
          "11-26": 0.0451,
          "11-27": 0.1434,
          "11-28": 0.7286,
          "11-29": 0.5691,
          "11-30": 0.9645,
          "12-01": 0.565,
          "12-02": 0.4884,
          "12-03": 0.6289,
          "12-04": 0.5857,
          "12-05": 0.6456,
          "12-06": 0.5756,
          "12-07": 0.2532,
          "12-08": 0.9306,
          "12-09": 0.8177
        },
        "time": {
          "12:00": 0.9859,
          "12:30": 0.3068,
          "13:00": 0.493,
          "13:30": 0.5662,
          "14:00": 0.3299,
          "14:30": 0.9372,
          "15:00": 0.9848,
          "15:30": 0.3425,
          "16:00": 0.7683,
          "16:30": 0.318,
          "17:00": 0.124,
          "17:30": 0.2452,
          "18:00": 0.2371,
          "18:30": 0.751,
          "19:00": 0.1395,
          "19:30": 0.7026,
          "20:00": 0.471,
          "20:30": 0.6752,
          "21:00": 0.9595,
          "21:30": 0.541
        },
        "venue": {
          "강남": 0.2327,
          "홍대": 0.3954,
          "잠실": 0.7514,
          "왕십리": 0.1764,
          "용산": 0.667,
          "영등포": 0.9692,
          "신촌": 0.4401,
          "건대입구": 0.4979,
          "목동": 0.7632,
          "코엑스": 0.1244
        },
        "movie": {
          "겨울 항해": 0.0691,
          "붉은 사막": 0.4503,
          "야간비행": 0.5925,
          "종이 도시": 0.4776,
          "여덟 번째 계절": 0.508,
          "파란 문": 0.2378,
          "먼 북소리": 0.1395,
          "은하 정거장": 0.9206,
          "조용한 이웃": 0.1205,
          "마지막 정류장": 0.8436,
          "빛의 속도로": 0.704,
          "검은 숲": 0.5327,
          "유리 정원": 0.4991,
          "새벽 세 시": 0.2954,
          "천 개의 파도": 0.1509,
          "우연한 여행자": 0.9472,
          "달의 뒷면": 0.3332,
          "낮은 목소리": 0.0471,
          "회색 항구": 0.5567,
          "봄의 알고리즘": 0.109
        }
      }
    },
    {
      "pid": "P1",
      "initial_threshold": 0.371,
      "weights": {
        "date": 0.1142,
        "time": 0.27,
        "venue": 0.1914,
        "movie": 0.4244
      },
      "scores": {
        "date": {
          "11-15": 0.0542,
          "11-16": 0.6993,
          "11-17": 0.522,
          "11-18": 0.6177,
          "11-19": 0.9524,
          "11-20": 0.6507,
          "11-21": 0.7551,
          "11-22": 0.4883,
          "11-23": 0.3564,
          "11-24": 0.2471,
          "11-25": 0.5617,
          "11-26": 0.4385,
          "11-27": 0.161,
          "11-28": 0.6381,
          "11-29": 0.2419,
          "11-30": 0.5049,
          "12-01": 0.2812,
          "12-02": 0.2659,
          "12-03": 0.3575,
          "12-04": 0.6219,
          "12-05": 0.3942,
          "12-06": 0.0908,
          "12-07": 0.557,
          "12-08": 0.4345,
          "12-09": 0.6812
        },
        "time": {
          "12:00": 0.9458,
          "12:30": 0.4685,
          "13:00": 0.9792,
          "13:30": 0.7441,
          "14:00": 0.2301,
          "14:30": 0.2413,
          "15:00": 0.5456,
          "15:30": 0.7758,
          "16:00": 0.8637,
          "16:30": 0.5254,
          "17:00": 0.7164,
          "17:30": 0.5489,
          "18:00": 0.9217,
          "18:30": 0.5026,
          "19:00": 0.5117,
          "19:30": 0.0733,
          "20:00": 0.8178,
          "20:30": 0.746,
          "21:00": 0.7307,
          "21:30": 0.1462
        },
        "venue": {
          "강남": 0.6293,
          "홍대": 0.0964,
          "잠실": 0.2684,
          "왕십리": 0.343,
          "용산": 0.6559,
          "영등포": 0.5808,
          "신촌": 0.8042,
          "건대입구": 0.2404,
          "목동": 0.6668,
          "코엑스": 0.2598
        },
        "movie": {
          "겨울 항해": 0.2089,
          "붉은 사막": 0.5542,
          "야간비행": 0.868,
          "종이 도시": 0.7277,
          "여덟 번째 계절": 0.8246,
          "파란 문": 0.5372,
          "먼 북소리": 0.0626,
          "은하 정거장": 0.4,
          "조용한 이웃": 0.8713,
          "마지막 정류장": 0.3104,
          "빛의 속도로": 0.5013,
          "검은 숲": 0.2779,
          "유리 정원": 0.5475,
          "새벽 세 시": 0.0594,
          "천 개의 파도": 0.2012,
          "우연한 여행자": 0.8376,
          "달의 뒷면": 0.8277,
          "낮은 목소리": 0.4593,
          "회색 항구": 0.7939,
          "봄의 알고리즘": 0.0764
        }
      }
    },
    {
      "pid": "P2",
      "initial_threshold": 0.467,
      "weights": {
        "date": 0.2102,
        "time": 0.4773,
        "venue": 0.2309,
        "movie": 0.0816
      },
      "scores": {
        "date": {
          "11-15": 0.8194,
          "11-16": 0.4794,
          "11-17": 0.0294,
          "11-18": 0.218,
          "11-19": 0.1224,
          "11-20": 0.5044,
          "11-21": 0.0691,
          "11-22": 0.5765,
          "11-23": 0.3437,
          "11-24": 0.7023,
          "11-25": 0.0038,
          "11-26": 0.8189,
          "11-27": 0.3514,
          "11-28": 0.6738,
          "11-29": 0.8056,
          "11-30": 0.9813,
          "12-01": 0.6662,
          "12-02": 0.2272,
          "12-03": 0.0232,
          "12-04": 0.9991,
          "12-05": 0.8981,
          "12-06": 0.1647,
          "12-07": 0.8096,
          "12-08": 0.4446,
          "12-09": 0.7736
        },
        "time": {
          "12:00": 0.2054,
          "12:30": 0.2816,
          "13:00": 0.5052,
          "13:30": 0.8585,
          "14:00": 0.2055,
          "14:30": 0.9249,
          "15:00": 0.2558,
          "15:30": 0.4535,
          "16:00": 0.0961,
          "16:30": 0.7777,
          "17:00": 0.5724,
          "17:30": 0.8533,
          "18:00": 0.2835,
          "18:30": 0.5129,
          "19:00": 0.3973,
          "19:30": 0.7801,
          "20:00": 0.7914,
          "20:30": 0.0722,
          "21:00": 0.3905,
          "21:30": 0.775
        },
        "venue": {
          "강남": 0.9412,
          "홍대": 0.4455,
          "잠실": 0.01,
          "왕십리": 0.5623,
          "용산": 0.3912,
          "영등포": 0.0646,
          "신촌": 0.6995,
          "건대입구": 0.6823,
          "목동": 0.9692,
          "코엑스": 0.5324
        },
        "movie": {
          "겨울 항해": 0.0926,
          "붉은 사막": 0.0579,
          "야간비행": 0.6738,
          "종이 도시": 0.6685,
          "여덟 번째 계절": 0.7254,
          "파란 문": 0.7329,
          "먼 북소리": 0.4498,
          "은하 정거장": 0.9758,
          "조용한 이웃": 0.1431,
          "마지막 정류장": 0.5688,
          "빛의 속도로": 0.0841,
          "검은 숲": 0.4866,
          "유리 정원": 0.5077,
          "새벽 세 시": 0.3885,
          "천 개의 파도": 0.6932,
          "우연한 여행자": 0.519,
          "달의 뒷면": 0.4344,
          "낮은 목소리": 0.0267,
          "회색 항구": 0.7155,
          "봄의 알고리즘": 0.1648
        }
      }
    }
  ],
  "meta": {
    "schema_version": "issue-space-case.v1",
    "track": "issue_space",
    "scenario_type": "movie_appointment",
    "combination_count": 100000,
    "issue_sizes": [
      25,
      20,
      10,
      20
    ],
    "common_feasible_count": 37843,
    "expected_no_deal": false,
    "description": "영화 약속 3인 사례 — 의제 4개(날짜 25 × 시간 20 × 영화관 10 × 영화 20) = 조합 100,000개. 후보는 의제 값의 곱이며 utility는 의제 가중합으로 실행 시 계산한다. 전원의 initial threshold를 넘는 공통 실후보는 37,843개다."
  }
}
