{
  "case_id": "IB-10p-S000192-004",
  "issues": [
    {
      "id": "date",
      "name": "날짜",
      "values": [
        "11-15",
        "11-16",
        "11-17",
        "11-18"
      ]
    },
    {
      "id": "time",
      "name": "시간",
      "values": [
        "12:00",
        "12:30",
        "13:00",
        "13:30"
      ]
    },
    {
      "id": "venue",
      "name": "영화관",
      "values": [
        "강남",
        "홍대",
        "잠실",
        "왕십리"
      ]
    },
    {
      "id": "movie",
      "name": "영화",
      "values": [
        "겨울 항해",
        "붉은 사막",
        "야간비행"
      ]
    }
  ],
  "participants": [
    {
      "pid": "P0",
      "initial_threshold": 0.3897,
      "weights": {
        "date": 0.1905,
        "time": 0.2069,
        "venue": 0.3687,
        "movie": 0.2339
      },
      "scores": {
        "date": {
          "11-15": 0.2362,
          "11-16": 0.5764,
          "11-17": 0.0799,
          "11-18": 0.3976
        },
        "time": {
          "12:00": 0.7739,
          "12:30": 0.3737,
          "13:00": 0.1407,
          "13:30": 0.7198
        },
        "venue": {
          "강남": 0.7182,
          "홍대": 0.6921,
          "잠실": 0.695,
          "왕십리": 0.1731
        },
        "movie": {
          "겨울 항해": 0.3863,
          "붉은 사막": 0.7418,
          "야간비행": 0.452
        }
      }
    },
    {
      "pid": "P1",
      "initial_threshold": 0.4263,
      "weights": {
        "date": 0.1525,
        "time": 0.2745,
        "venue": 0.2599,
        "movie": 0.3131
      },
      "scores": {
        "date": {
          "11-15": 0.9048,
          "11-16": 0.6119,
          "11-17": 0.0726,
          "11-18": 0.4059
        },
        "time": {
          "12:00": 0.78,
          "12:30": 0.0611,
          "13:00": 0.0231,
          "13:30": 0.4802
        },
        "venue": {
          "강남": 0.6421,
          "홍대": 0.1807,
          "잠실": 0.7005,
          "왕십리": 0.3865
        },
        "movie": {
          "겨울 항해": 0.1819,
          "붉은 사막": 0.15,
          "야간비행": 0.2282
        }
      }
    },
    {
      "pid": "P2",
      "initial_threshold": 0.4043,
      "weights": {
        "date": 0.353,
        "time": 0.1299,
        "venue": 0.2858,
        "movie": 0.2313
      },
      "scores": {
        "date": {
          "11-15": 0.5764,
          "11-16": 0.748,
          "11-17": 0.8821,
          "11-18": 0.177
        },
        "time": {
          "12:00": 0.602,
          "12:30": 0.2018,
          "13:00": 0.8784,
          "13:30": 0.4387
        },
        "venue": {
          "강남": 0.188,
          "홍대": 0.8532,
          "잠실": 0.6755,
          "왕십리": 0.6852
        },
        "movie": {
          "겨울 항해": 0.5241,
          "붉은 사막": 0.3012,
          "야간비행": 0.2539
        }
      }
    },
    {
      "pid": "P3",
      "initial_threshold": 0.3958,
      "weights": {
        "date": 0.2526,
        "time": 0.1454,
        "venue": 0.3715,
        "movie": 0.2305
      },
      "scores": {
        "date": {
          "11-15": 0.6189,
          "11-16": 0.1934,
          "11-17": 0.8655,
          "11-18": 0.6074
        },
        "time": {
          "12:00": 0.3607,
          "12:30": 0.7985,
          "13:00": 0.0732,
          "13:30": 0.0624
        },
        "venue": {
          "강남": 0.5029,
          "홍대": 0.4061,
          "잠실": 0.0973,
          "왕십리": 0.3575
        },
        "movie": {
          "겨울 항해": 0.6627,
          "붉은 사막": 0.7461,
          "야간비행": 0.9918
        }
      }
    },
    {
      "pid": "P4",
      "initial_threshold": 0.4048,
      "weights": {
        "date": 0.2122,
        "time": 0.3767,
        "venue": 0.1114,
        "movie": 0.2997
      },
      "scores": {
        "date": {
          "11-15": 0.472,
          "11-16": 0.4482,
          "11-17": 0.4719,
          "11-18": 0.8369
        },
        "time": {
          "12:00": 0.9405,
          "12:30": 0.1509,
          "13:00": 0.8855,
          "13:30": 0.2481
        },
        "venue": {
          "강남": 0.8353,
          "홍대": 0.6704,
          "잠실": 0.7347,
          "왕십리": 0.5587
        },
        "movie": {
          "겨울 항해": 0.3679,
          "붉은 사막": 0.4343,
          "야간비행": 0.0706
        }
      }
    },
    {
      "pid": "P5",
      "initial_threshold": 0.4328,
      "weights": {
        "date": 0.388,
        "time": 0.3875,
        "venue": 0.089,
        "movie": 0.1355
      },
      "scores": {
        "date": {
          "11-15": 0.5151,
          "11-16": 0.4363,
          "11-17": 0.7497,
          "11-18": 0.2031
        },
        "time": {
          "12:00": 0.137,
          "12:30": 0.1526,
          "13:00": 0.7623,
          "13:30": 0.5778
        },
        "venue": {
          "강남": 0.9932,
          "홍대": 0.166,
          "잠실": 0.7275,
          "왕십리": 0.7038
        },
        "movie": {
          "겨울 항해": 0.451,
          "붉은 사막": 0.8844,
          "야간비행": 0.5531
        }
      }
    },
    {
      "pid": "P6",
      "initial_threshold": 0.3948,
      "weights": {
        "date": 0.3114,
        "time": 0.2993,
        "venue": 0.1491,
        "movie": 0.2402
      },
      "scores": {
        "date": {
          "11-15": 0.359,
          "11-16": 0.7806,
          "11-17": 0.9191,
          "11-18": 0.1387
        },
        "time": {
          "12:00": 0.6344,
          "12:30": 0.1861,
          "13:00": 0.2593,
          "13:30": 0.9964
        },
        "venue": {
          "강남": 0.1228,
          "홍대": 0.7017,
          "잠실": 0.2803,
          "왕십리": 0.1811
        },
        "movie": {
          "겨울 항해": 0.9134,
          "붉은 사막": 0.9502,
          "야간비행": 0.3329
        }
      }
    },
    {
      "pid": "P7",
      "initial_threshold": 0.4055,
      "weights": {
        "date": 0.4621,
        "time": 0.1602,
        "venue": 0.1555,
        "movie": 0.2222
      },
      "scores": {
        "date": {
          "11-15": 0.7303,
          "11-16": 0.315,
          "11-17": 0.7223,
          "11-18": 0.3403
        },
        "time": {
          "12:00": 0.0195,
          "12:30": 0.1025,
          "13:00": 0.4718,
          "13:30": 0.5969
        },
        "venue": {
          "강남": 0.8126,
          "홍대": 0.9053,
          "잠실": 0.5121,
          "왕십리": 0.1356
        },
        "movie": {
          "겨울 항해": 0.929,
          "붉은 사막": 0.4044,
          "야간비행": 0.1232
        }
      }
    },
    {
      "pid": "P8",
      "initial_threshold": 0.4204,
      "weights": {
        "date": 0.2394,
        "time": 0.2952,
        "venue": 0.2083,
        "movie": 0.2571
      },
      "scores": {
        "date": {
          "11-15": 0.6389,
          "11-16": 0.8375,
          "11-17": 0.6281,
          "11-18": 0.8217
        },
        "time": {
          "12:00": 0.7892,
          "12:30": 0.5189,
          "13:00": 0.2949,
          "13:30": 0.2656
        },
        "venue": {
          "강남": 0.9574,
          "홍대": 0.6605,
          "잠실": 0.9466,
          "왕십리": 0.6186
        },
        "movie": {
          "겨울 항해": 0.5552,
          "붉은 사막": 0.3779,
          "야간비행": 0.2959
        }
      }
    },
    {
      "pid": "P9",
      "initial_threshold": 0.4011,
      "weights": {
        "date": 0.2714,
        "time": 0.1619,
        "venue": 0.0816,
        "movie": 0.4851
      },
      "scores": {
        "date": {
          "11-15": 0.4834,
          "11-16": 0.1341,
          "11-17": 0.8686,
          "11-18": 0.5007
        },
        "time": {
          "12:00": 0.815,
          "12:30": 0.9863,
          "13:00": 0.206,
          "13:30": 0.8164
        },
        "venue": {
          "강남": 0.3144,
          "홍대": 0.8521,
          "잠실": 0.4892,
          "왕십리": 0.3612
        },
        "movie": {
          "겨울 항해": 0.9865,
          "붉은 사막": 0.9915,
          "야간비행": 0.0883
        }
      }
    }
  ],
  "meta": {
    "schema_version": "issue-space-case.v1",
    "track": "issue_space",
    "scenario_type": "movie_appointment",
    "combination_count": 192,
    "issue_sizes": [
      4,
      4,
      4,
      3
    ],
    "common_feasible_count": 10,
    "expected_no_deal": false,
    "tags": [
      "track:b",
      "issues:4",
      "participants:10",
      "feasible_ratio:0.0521"
    ],
    "description": "영화 약속 10인 사례 — 의제 4개(날짜 4 × 시간 4 × 영화관 4 × 영화 3) = 조합 192개. 후보는 의제 값의 곱이며 utility는 의제 가중합으로 실행 시 계산한다. 전원의 initial threshold를 넘는 공통 실후보는 10개다."
  }
}
